{
  "schema_version": "1.3",
  "agreed_between": ["anrbj666-police", "anrbj666-thief"],
  "board_and_agents": {
    "grid_size": 7,
    "num_agents": 2,
    "thief_start": [3, 3],
    "cop_start": [0, 0],
    "axis_origin_corner": "top-left",
    "axis_start_index": 0
  },
  "world": {
    "map_area": "New York",
    "hint_max_words": 15
  },
  "movement_and_barriers": {
    "move_set": ["N", "S", "E", "W", "STAY"],
    "max_barriers": 14,
    "max_moves": 35,
    "survival_threshold": 35
  },
  "scoring": {
    "capture_cop": 20,
    "capture_thief": 5,
    "survival_cop": 5,
    "survival_thief": 10,
    "tie_score": 2,
    "technical_loss": 0
  },
  "pheromones": {
    "pheromone_center_intensity": 0.9,
    "pheromone_decay": 0.1,
    "pheromone_grid_size": 5,
    "min_center_intensity": 0.5
  },
  "network_and_league": {
    "response_timeout_sec": 30,
    "watchdog_timeout_sec": 60,
    "num_games": 6,
    "diversity_reward": 10,
    "min_games_to_pass": 2,
    "max_games_per_team": 10,
    "token_budget_per_series": 200000
  },
  "rate_limiter_gatekeeper": {
    "requests_per_minute": 30,
    "concurrent_requests": 2,
    "retry_backoff_sec": 5,
    "max_retries": 3,
    "queue_depth": 100
  }
}
